name,type,river_slugs,slug,status,phone,phone_toll_free,email,website,reservation_url,booking_platform,address_line1,city,state,zip,latitude,longitude,description,services_offered,seasonal_notes,nps_authorized,usfs_authorized,tent_sites,rv_sites,cabin_count,fee_range,season_open_month,season_close_month,display_order
RiverStop,outfitter,spring-river,,active,870-955-5088,,Justinnelson1535@gmail.com,https://www.riverstopoutfitters.com,,,,Hardy,AR,72542,,,Dam 3->Hardy floats; trips flexible by daily flow (Dam 3 weekend floats require reservations). Store with coffee/smoothies/pizza. CALL for the high-water do-not-float cutoff (dangerous anchor).,canoe_rental|kayak_rental|raft_rental|tube_rental|shuttle|general_store,,,,,,,,,,1
River Wilderness Sports,outfitter,spring-river,,active,870-955-5003,,,,,,420 US-63 N,Hardy,AR,72542,,,"Hardy outfitter (Dam 3->Hardy reach); rafts, canoes, tandem kayaks, cooler floats, fishing tackle. CALL for the high-water do-not-float cutoff.",canoe_rental|kayak_rental|raft_rental|tube_rental|shuttle|fishing_supplies,,,,,,,,,,2
Spring River Outdoors,outfitter,spring-river,,active,870-751-3399,,,,,,1242 US-63,Hardy,AR,,,,Fishing-kayak rentals and shuttle; bait & tackle (Facebook).,kayak_rental|shuttle|fishing_supplies,,,,,,,,,,3
Spring River Camp & Canoe,campground,spring-river,,active,870-847-5274,,,http://springrivercampground.com,,,,Hardy,AR,72542,36.3194,-91.4707,"US-63 Hardy; canoe rentals, float trips, camping.",canoe_rental|shuttle|camping_primitive,,,,,,,,,,4
Many Islands Camp & Canoe Rental,campground,spring-river,,active,870-856-3451,,,http://www.manyislands.com,,,2988 Many Islands Rd,Mammoth Spring,AR,72554,,,"Upper Spring River private access (60+ yrs); electric hookups, ~1 mi of shaded sites, grocery/bait & tackle.",canoe_rental|kayak_rental|raft_rental|camping_primitive|camping_rv|general_store,Camping Apr 1 - Sep 30,,,,,,,,,5
Southfork Resort,cabin_lodge,spring-river,,active,870-895-2803,,,https://southforkresort.com,,,7230 AR-289 N,Mammoth Spring,AR,72554,,,"South Fork of the Spring River; 7 kitchen cabins, 22 camping/RV sites, guided float & fishing trips.",canoe_rental|cabins|camping_primitive|camping_rv|showers|general_store,,,,,,,,,,6
Three Rivers Outfitters,outfitter,spring-river,,unverified,,,,,,,,Hardy,AR,,,,Named in AR tourism directories but website unresolved at research time — VERIFY still operating before publishing.,canoe_rental|kayak_rental|raft_rental,,,,,,,,,,7
